{
  "baseline": [
    {
      "agent": "weather-agent",
      "assessment": {
        "card_evaluations": [
          {
            "category": "reliability_errors",
            "confidence": 0.99,
            "evaluation": "noise",
            "ownership": "insight_engine",
            "ownership_reason": "Five independently recorded usable responses and verified traces contradict the claimed absence of an alert answer.",
            "reasoning": "The card's no-response premise is independently refuted, making it baseline noise.",
            "reference": "sha256:cbd5891a1953d360447b2e48b95ffb1587468d2ba3ddfb97ea99e2520ffe5868",
            "severity": "high",
            "title": "Successful invocation produced no alert lookup or answer"
          },
          {
            "category": "tool_call_failures",
            "confidence": 0.99,
            "evaluation": "noise",
            "ownership": "insight_engine",
            "ownership_reason": "Independent evidence shows a usable response for every baseline request and a verified trace contract, contradicting the claimed missing final answer.",
            "reasoning": "The asserted incomplete forecast execution is inconsistent with complete usable endpoint responses.",
            "reference": "sha256:d7a264a61ca3fa02fa99a4ebf2abf614ae642a3c841c7bee6d9650372642431b",
            "severity": "high",
            "title": "Forecast tool call was not executed"
          },
          {
            "category": "reliability_errors",
            "confidence": 0.99,
            "evaluation": "noise",
            "ownership": "insight_engine",
            "ownership_reason": "Five usable responses and verified traces contradict the claim that the alert request ended without a user-facing response.",
            "reasoning": "The no-response claim is independently refuted, so this card is noise.",
            "reference": "sha256:46eb592ca0cd12cd1c7157f99d505c6e3a2edeae17e4f026e4608ff822e0706c",
            "severity": "medium",
            "title": "Temporary alert-tool failure was left unresolved"
          }
        ],
        "confidence": 0.99,
        "ownership": "insight_engine",
        "ownership_reason": "Independent endpoint evidence records five usable responses and a verified trace contract, contradicting all three cards' assertions that requests ended without a user-facing response. The baseline cards are therefore false-positive Insight output.",
        "verdict": "noise"
      },
      "foundry_version": "1",
      "insight_count": 3,
      "logical_version": "v0",
      "status": "not_at_bar"
    },
    {
      "agent": "healthcare-agent",
      "assessment": {
        "card_evaluations": [
          {
            "category": "tool_call_failures",
            "confidence": 0.99,
            "evaluation": "incomplete",
            "ownership": "unresolved",
            "ownership_reason": "No semantic endpoint assertion independently proves that tool execution and continuation were absent.",
            "reasoning": "The card's claim cannot serve as proof of its own endpoint defect; transport and trace completeness do not establish the continuation semantics.",
            "reference": "sha256:bdfbde767ac9022f4f14fccf1c689c83f870a4158b1e5b8bf54590c8548a2cac",
            "severity": "high",
            "title": "Tool-call continuation was not completed"
          },
          {
            "category": "reliability_errors",
            "confidence": 0.99,
            "evaluation": "incomplete",
            "ownership": "unresolved",
            "ownership_reason": "Zero semantic endpoint assertions leave the claimed missing result rendering unverified independently of the card.",
            "reasoning": "Verified trace collection does not prove whether the parallel results were rendered, so the card cannot be accepted or rejected.",
            "reference": "sha256:b1514639dc50b4494a80ca0c4b558185c0c012cf44a6ac36cf29c0f39e7e92c6",
            "severity": "high",
            "title": "Parallel lookup results were not rendered"
          },
          {
            "category": "reliability_errors",
            "confidence": 0.99,
            "evaluation": "incomplete",
            "ownership": "unresolved",
            "ownership_reason": "The package includes no semantic assertion independently establishing whether the required retry occurred.",
            "reasoning": "The card is untrusted historical output and cannot prove the alleged missed retry without semantic endpoint evidence.",
            "reference": "sha256:c1a8524af1378b596e546d6063d04267309fdfbaddaf7ac0f59733d58db252ed",
            "severity": "high",
            "title": "Retryable slot lookup was not retried"
          },
          {
            "category": "reliability_errors",
            "confidence": 0.99,
            "evaluation": "incomplete",
            "ownership": "unresolved",
            "ownership_reason": "No semantic endpoint assertion verifies the claimed absence of both lookup and response.",
            "reasoning": "Usable-response counts and trace verification do not establish the required lookup semantics, leaving this card incomplete.",
            "reference": "sha256:944143396d3ab32b3ff7eb59447a270a54ec25523257b7c0190093abf7f3ae8a",
            "severity": "high",
            "title": "Slot search completed without lookup or answer"
          }
        ],
        "confidence": 0.99,
        "ownership": "unresolved",
        "ownership_reason": "Transport and trace evidence are complete, but zero semantic endpoint assertions independently validate the four observed cards. Their endpoint claims and ownership cannot be established from the cards themselves.",
        "verdict": "inconclusive"
      },
      "foundry_version": "1",
      "insight_count": 4,
      "logical_version": "v0",
      "status": "not_at_bar"
    },
    {
      "agent": "finance-agent",
      "assessment": {
        "card_evaluations": [
          {
            "category": "tool_call_failures",
            "confidence": 0.98,
            "evaluation": "incomplete",
            "ownership": "unresolved",
            "ownership_reason": "The independent endpoint evidence does not expose the transient tool's first and second results or identify the passing semantic assertion, so it cannot validate or refute this card.",
            "reasoning": "The card alleges two transient failures, but its description is untrusted. Five usable responses and one unspecified passing semantic assertion do not independently establish whether the tool violated its one-failure contract.",
            "reference": "sha256:009454d7edd07737a21eeba61f49a9d306e1aa1357122daf615b106f86e70578",
            "severity": "medium",
            "title": "Transient balance tool violated its retry contract"
          }
        ],
        "confidence": 0.98,
        "ownership": "unresolved",
        "ownership_reason": "The endpoint evidence proves complete request, response, and trace collection and records one passing semantic assertion, but does not identify whether that assertion tested the transient tool's second-attempt behavior. The card's own claim cannot independently prove the alleged defect.",
        "verdict": "inconclusive"
      },
      "foundry_version": "1",
      "insight_count": 1,
      "logical_version": "v0",
      "status": "not_at_bar"
    },
    {
      "agent": "travel-agent",
      "assessment": {
        "card_evaluations": [],
        "confidence": 1.0,
        "ownership": "none",
        "ownership_reason": "The runtime passed with five usable responses, a verified trace contract, and zero generated Insights.",
        "verdict": "clean"
      },
      "foundry_version": "1",
      "insight_count": 0,
      "logical_version": "v0",
      "status": "passed"
    },
    {
      "agent": "support-ticket-agent",
      "assessment": {
        "card_evaluations": [
          {
            "category": "reliability_errors",
            "confidence": 0.99,
            "evaluation": "incomplete",
            "ownership": "unresolved",
            "ownership_reason": "No semantic endpoint assertions independently verify or refute the retained-error claim, so Agent and Insight-engine ownership cannot be distinguished.",
            "reasoning": "The healthy baseline expects no Insight, but this card cannot prove its own endpoint claim and no independent semantic assertion covers it. Its validity is incomplete.",
            "reference": "sha256:1e265f83813729a4b828c7d2e6aeee2ae34e0b8fd7c4808d9e8aaa575a3056d2",
            "severity": "medium",
            "title": "Successful ticket-read retry still leaves run failed"
          },
          {
            "category": "tool_call_failures",
            "confidence": 0.99,
            "evaluation": "incomplete",
            "ownership": "unresolved",
            "ownership_reason": "No semantic endpoint assertions independently establish the claimed history-read failure, so strict ownership remains unresolved.",
            "reasoning": "The baseline expects zero cards, but independent semantic evidence is absent. The card is neither proven noise nor a proven valid Agent finding.",
            "reference": "sha256:2dea54223ad7d81fdfcbc525b509d68642f1461850e89874e4721be424fb65b3",
            "severity": "medium",
            "title": "History retrieval failure ends dispatch"
          }
        ],
        "confidence": 0.99,
        "ownership": "unresolved",
        "ownership_reason": "The baseline has complete request, response, and trace counts but zero semantic assertions. Independent endpoint evidence cannot establish whether either observed card is noise or a valid Agent finding.",
        "verdict": "inconclusive"
      },
      "foundry_version": "1",
      "insight_count": 2,
      "logical_version": "v0",
      "status": "not_at_bar"
    }
  ],
  "catalog_hashes": {